,source,author,title,description,url,urlToImage,publishedAt,content
72,"{'id': 'news24', 'name': 'News24'}",,'A world in disorder': Pandemic preparedness panel slams collective failure to heed warnings,"A collective failure by political leaders to heed warnings and prepare for an infectious disease pandemic has transformed ""a world at risk"" to a ""world in disorder"", according to a report on international epidemic preparedness.",https://www.news24.com/news24/World/News/a-world-in-disorder-pandemic-preparedness-panel-slams-collective-failure-to-heed-warnings-20200914,https://cdn.24.co.za/files/Cms/General/d/459/d36bd18224924caeb76b2e1e32a6b2f6.jpg,2020-09-14T17:32:25+00:00,"A collective failure by political leaders to heed warnings and prepare for an infectious disease pandemic has transformed ""a world at risk"" to a ""world in disorder"", according to a report on internat… [+2311 chars]"
73,"{'id': 'business-insider', 'name': 'Business Insider'}","Aylin Woodward, Dave Mosher",Astronomers found a gas in Venus' clouds that could signal alien life - Business Insider,"Scientists discovered trace amounts of phosphine gas in clouds on Venus. On Earth, this gas is typically produced by microbes.",http://www.businessinsider.com/venus-clouds-phosphine-gas-microbes-alien-life-2020-9,https://i.insider.com/5f5f7ca5e6ff30001d4e8912?width=1200&format=jpeg,2020-09-14T17:31:00Z,Astronomers have assumed for some time that the best places to hunt for extraterrestrial life in our solar system are on Jupiter and Saturn's moons or on Mars. But new research suggests we should che… [+6917 chars]
74,"{'id': 'business-insider-uk', 'name': 'Business Insider (UK)'}","Aylin Woodward, Dave Mosher",Astronomers found a gas in Venus' clouds that could signal alien life - Business Insider,"Scientists discovered trace amounts of phosphine gas in clouds on Venus. On Earth, this gas is typically produced by microbes.",http://uk.businessinsider.com/venus-clouds-phosphine-gas-microbes-alien-life-2020-9,https://i.insider.com/5f5f7ca5e6ff30001d4e8912?width=1200&format=jpeg,2020-09-14T17:31:00Z,Astronomers have assumed for some time that the best places to hunt for extraterrestrial life in our solar system are on Jupiter and Saturn's moons or on Mars. But new research suggests we should che… [+6917 chars]
75,"{'id': 'the-hill', 'name': 'The Hill'}",The Hill staff,Watch Live: Joe Biden to deliver remarks on wildfires,"Joe Biden is speaking from Wilmington, Del., on Monday about the wildfires in California, Oregon and Washington.The event starts at 12:45 p.m. EDT. Watch the live video above.",http://thehill.com/video/in-the-news/516321-watch-live-joe-biden-speaks-about-climate-change-and-fires-in-california,https://thehill.com/sites/default/files/bidenjoe_842020_gettyimages.jpg,2020-09-14T17:30:02Z,"The Hill 1625 K Street, NW Suite 900 Washington DC 20006 | 202-628-8500 tel | 202-628-8503 fax
The contents of this site are ©2020 Capitol Hill Publishing Corp., a subsidiary of News Communications,… [+4 chars]"
76,"{'id': 'the-verge', 'name': 'The Verge'}",Owen S. Good,How an NFL player’s mom got her own Madden cover,"Felicia Boykin, mother of NFL receiver Miles Boykin of the Baltimore Ravens, was surprised with a custom Madden NFL 21 cover starring her. It was a humorous make-good for finding out she’d been paying for Miles’ Xbox Live Gold subscription since he was in six…",https://www.polygon.com/2020/9/14/21436425/mom-pays-xbox-live-for-nfl-player-miles-boykin-felicia-boykin-madden-nfl-21-xbox,https://cdn.vox-cdn.com/thumbor/3KOcnjdSfkd-0O4AbnbLKYrY18w=/0x417:1511x1208/fit-in/1200x630/cdn.vox-cdn.com/uploads/chorus_asset/file/21880083/l6ahWZag.jpg,2020-09-14T17:27:30Z,"This summer, Felicia Boykin found out her sixth-grade son, Miles, put his Xbox Live Gold subscription on her credit card without telling her. Miles Boykin is no longer in the sixth grade. Hes in the … [+1985 chars]"
77,"{'id': 'the-irish-times', 'name': 'The Irish Times'}",Aodhan O'Faolain,Charlotte Mulhall takes court action over move to Limerick Prison,Convicted murderer says transfer after alleged incident with prison officer caused great stress,https://www.irishtimes.com/							/news/crime-and-law/courts/high-court/charlotte-mulhall-takes-court-action-over-move-to-limerick-prison-1.4354715	,https://www.irishtimes.com/image-creator/?id=1.4354713&origw=960,2020-09-14T17:24:02Z,"Charlotte Mulhall, who has served 14 years of a life sentence for murder of her mothers boyfriend, has brought a High Court challenge over being moved to Limerick Prison from the Dóchas Centre womans… [+3408 chars]"
78,"{'id': 'the-hill', 'name': 'The Hill'}",Cristina Marcos,Pelosi defends not speaking to Trump for almost a year | TheHill,"Speaker Nancy Pelosi (D-Calif.) on Monday defended not speaking directly to President Trump for almost a year amid the current coronavirus pandemic and wildfire crises, maintaining that she finds it ""in the interest of time"" to speak to intermediaries.",http://thehill.com/homenews/house/516320-pelosi-defends-not-speaking-to-trump-for-almost-a-year,https://thehill.com/sites/default/files/article_images/trumppelosi.png,2020-09-14T17:23:04Z,"Speaker Nancy PelosiNancy PelosiBiden marks anniversary of the Violence Against Women Act, knocks Trump and McConnellSunday shows - Trump team defends coronavirus responseGOP chair defends Trump mess… [+5427 chars]"
79,"{'id': 'breitbart-news', 'name': 'Breitbart News'}",Breitbart News,"Pennsylvania: Judge Rules Wolf, Levine's Shutdown Orders Unconstitutional","HARRISBURG, P.A. (AP) — Federal judge rules that Pennsylvania Gov. Tom Wolf's pandemic restrictions are unconstitutional.",http://www.breitbart.com/politics/2020/09/14/pennsylvania-judge-rules-wolf-levines-shutdown-orders-unconstitutional/,https://media.breitbart.com/media/2020/09/49666579573_70acf8fc46_k-640x335.jpg,2020-09-14T17:22:55Z,"PITTSBURGH (AP) A federal judge on Monday struck down Gov. Tom Wolfs pandemic restrictions that required people to stay at home, placed size limits on gatherings and ordered non-life-sustaining busin… [+1578 chars]"
80,"{'id': 'buzzfeed', 'name': 'Buzzfeed'}","[{""@type"":""Person"",""name"":""Daniella Emanuel"",""url"":""https://www.buzzfeed.com/daniellaemanuel"",""jobTitle"":""BuzzFeed Staff""}]",14 Really Famous Songs You May Not Have Realized Were About Another Celebrity,These might sound a little different now.,https://www.buzzfeed.com/daniellaemanuel/famous-songs-celebrities,"https://img.buzzfeed.com/buzzfeed-static/static/2020-09/9/21/enhanced/299fe1474a6b/original-2554-1599686372-6.jpg?crop=1250:654;0,0%26downsize=1250:*",2020-09-14T17:22:30.5964223Z,
81,"{'id': 'ign', 'name': 'IGN'}",,Lost & Crowned - A Clash Short - IGN,"Watch this animated short film featuring characters from Supercell's Clash of Clans and Clash Royale games. 

In Lost & Crowned, follow the adventures of brothers Peter and Larry. When the pair are tasked with guarding the Red King's Crown on a late-night s…",https://www.ign.com/videos/lost-crowned-a-clash-short,https://assets1.ignimgs.com/thumbs/userUploaded/2020/9/14/clashthumb-1600101411055.jpg?width=1280,2020-09-14T17:22:23.0045622Z,Did you enjoy this video?
82,"{'id': 'cbc-news', 'name': 'CBC News'}",CBC News,"Ontario's COVID-19 case numbers rise, upping pressure on Ford government | CBC News","Ontario's COVID-19 case numbers are rising at a rate not seen for months, upping the pressure on Premier Doug Ford's government and public health officials to take fresh action.",http://www.cbc.ca/news/canada/toronto/covid-19-ontario-case-numbers-rising-legislature-returns-1.5720931,https://i.cbc.ca/1.5584948.1590506506!/cpImage/httpImage/image.jpg_gen/derivatives/16x9_620/covid-ontario-20200525.jpg,2020-09-14T17:22:22.0048102Z,"Ontario's COVID-19 cases are rising at a rate not seen for months, upping the pressure on Premier Doug Ford's government and public health officials to take fresh action to slow the spread of the cor… [+6608 chars]"
83,"{'id': 'the-huffington-post', 'name': 'The Huffington Post'}",Nina Golgowski,Georgia Deputy Fired After Black Man Beaten In Traffic Stop Video,"Roderick Walker, a passenger in the vehicle, was repeatedly punched in the head after he failed to provide ID to deputies, his attorney said.",https://www.huffpost.com/entry/georgia-deputy-fired-roderick-walker-arrest_n_5f5f63a4c5b6b485080334c6,https://img.huffingtonpost.com/asset/5f5f95901e0000de0d475938.png?cache=F1tb60ZqxM&ops=1200_630,2020-09-14T17:20:40Z,"A Georgia deputy sheriff has been fired following an investigation into a video showing a Black man being beaten on an Atlanta street during a traffic stop on Friday.
The unidentified deputy was ter… [+2529 chars]"
84,"{'id': 'the-hill', 'name': 'The Hill'}",Nathaniel Weixel,"Top HHS official accuses scientists of plotting against Trump, tells supporters to buy ammunition | TheHill",The top communications official at the Department of Health and Human Services (HHS) a...,http://thehill.com/policy/healthcare/516319-top-hhs-official-accuses-scientists-of-plotting-against-trump-tells,https://thehill.com/sites/default/files/caputo_michael_gettyimages-814646354.jpg,2020-09-14T17:18:36Z,The top communications official at the Department of Health and Human Services (HHS) accused career government scientists of plotting against President TrumpDonald John TrumpCrowd aims 'lock him up' … [+1652 chars]
85,"{'id': 'the-hill', 'name': 'The Hill'}",Zack Budryk,Woodward audio: Trump focused on stock market as coronavirus surged in August | TheHill,President Trump remained largely focused on the stock market in August even as Bob Woodward told...,http://thehill.com/policy/healthcare/516316-woodward-audio-trump-focused-on-stock-market-as-coronavirus-surged-in,https://thehill.com/sites/default/files/trumpdonald_woodwardbook_091018.jpg,2020-09-14T17:17:09Z,President TrumpDonald John TrumpCrowd aims 'lock him up' chant at Obama during Trump rallyNevada governor: Trump 'taking reckless and selfish actions' in holding rallyMichigan lieutenant governor bla… [+1979 chars]
86,"{'id': 'google-news', 'name': 'Google News'}",https://www.facebook.com/BrantlyWx/,WEATHER ALERT: Sally upgraded to a Category 1 hurricane and rapidly intensifying; landfall likely Tuesday night,"Hurricane warnings, tropical storm warnings, and storm surge watches and warnings, have been issued for a portion of the northern Gulf Coast ahead of Sally.",https://www.wxxv25.com/2020/09/14/tracking-hurricane-sally-1/,https://www.wxxv25.com/wp-content/uploads/2020/09/SALLY-1130-AM-MONDAY.png,2020-09-14T17:17:00+00:00,"(WXXV) Sally has been upgraded to a Category 1 hurricane, as of 11:30 a.m. Monday.
The National Hurricane Center says NOAA Hurricane Hunters find the storm has rapidly strengthened. Maximum sustaine… [+2806 chars]"
87,"{'id': 'the-hindu', 'name': 'The Hindu'}",Soibam Rocky Singh,Centre opposes plea seeking recognition of same-sex marriages,"2018 judgment of Supreme Court “merely decriminalises homosexuality or lesbianism”, it tells Delhi High Court",https://www.thehindu.com/news/national/centre-opposes-plea-seeking-recognition-of-same-sex-marriages/article32603987.ece,https://www.thehindu.com/news/national/19ksnq/article32603986.ece/ALTERNATES/LANDSCAPE_615/LGBTQKB,2020-09-14T17:15:58Z,"The Central government on Monday opposed before the Delhi High Court a petition seeking recognition of same-sex marriage saying, our legal system, society and values do not recognise marriage between… [+3084 chars]"
88,"{'id': 'espn', 'name': 'ESPN'}",Todd ArcherESPN Staff Writer ,Source: Cowboys LB Leighton Vander Esch likely out 6-8 weeks with broken collarbone,"Cowboys LB Leighton Vander Esch is likely out 6-8 weeks after surgery Tuesday on his broken collarbone, a source tells ESPN.",http://espn.go.com/nfl/story/_/id/29885724/cowboys-lb-leighton-vander-esch-likely-6-8-weeks-broken-collarbone,https://a1.espncdn.com/combiner/i?img=%2Fphoto%2F2018%2F0925%2Fr436798_1296x729_16%2D9.jpg,2020-09-14T17:15:00Z,"FRISCO, Texas - Dallas Cowboys linebacker Leighton Vander Esch is scheduled to undergo surgery Tuesday on a broken left collarbone suffered in the season-opening loss to the Los Angeles Rams, accordi… [+1686 chars]"
89,"{'id': 'news24', 'name': 'News24'}",,WATCH | Durban funeral parlours shut down in strike,Various funeral associations affiliated to the Unification Task Team in Durban protested and have shut down funeral parlours as part of their three-day strike.,https://www.news24.com/news24/southafrica/news/watch-durban-funeral-parlours-shut-down-in-strike-20200914,https://cdn.24.co.za/files/Cms/General/d/10492/e9c0bbfa435c4e76a67e548b53c6daee.jpeg,2020-09-14T17:13:13+00:00,"<ul><li>Funeral parlours in the Durban CBD were shut down by protestors on Monday.</li><li>The protestors, who are made up of various funeral associations, vowed that no parlour would be open while t… [+2181 chars]"
90,"{'id': 'bbc-news', 'name': 'BBC News'}",BBC News,Canadian cable car cord severed for second time,The mountainside gondola ride only reopened a few months ago after an act of sabotage in 2019.,http://www.bbc.co.uk/news/world-us-canada-54112301,https://ichef.bbci.co.uk/news/1024/branded_news/5F47/production/_114319342_73929_gondola2.jpg,2020-09-14T17:12:29Z,"Image copyrightCourtesy RCMPImage caption
 The RCMP released images of some of the damage from the second act of vandalism
Canadian police are investigating after a cable car gondola was apparently… [+1425 chars]"
91,"{'id': 'al-jazeera-english', 'name': 'Al Jazeera English'}",Al Jazeera,Astronomers see possible hints of life in Venus's clouds,"Chemical signature of phosphine, a gas that on Earth is only associated with life, has been spotted in Venusian clouds.",http://www.aljazeera.com/ajimpact/astronomers-hints-life-venus-clouds-200914153426895.html,https://www.aljazeera.com/mritems/Images/2020/9/14/800de761e7294d88b0351cffab530f78_18.jpg,2020-09-14T17:12:00Z,"Astronomers have found a potential sign of life high in the atmosphere of neighbouring Venus: Hints there may be bizarre microbes living in the sulfuric acid-laden clouds of the hothouse planet.
Two… [+3817 chars]"
92,"{'id': 'breitbart-news', 'name': 'Breitbart News'}",Warner Todd Huston,"Baltimore Ravens Stand for 'Black National Anthem,' Most Protest During U.S. Anthem","On Sunday, the Baltimore Ravens all but two players stood during the ""black national anthem,"" but most either took a knee",http://www.breitbart.com/sports/2020/09/14/baltimore-ravens-stand-for-black-national-anthem-most-protest-during-u-s-anthem/,https://media.breitbart.com/media/2020/09/Getty-Images_Will-Newton-2-640x335.jpg,2020-09-14T17:08:50Z,"On Sunday, the Baltimore Ravens all but two players stood during the “black national anthem,” but most either took a knee or sat down as the American national anthem was played.
As the Ravens faced … [+1556 chars]"
93,"{'id': 'buzzfeed', 'name': 'Buzzfeed'}","[{""@type"":""Person"",""name"":""Ryan Schocket"",""url"":""https://www.buzzfeed.com/ryanschocket2"",""jobTitle"":""BuzzFeed Staff""}]",20 Hilarious Tweets From This Week,"That's a mask, mom...",https://www.buzzfeed.com/ryanschocket2/tweets-from-this-week-sept14,"https://img.buzzfeed.com/buzzfeed-static/static/2020-09/14/16/enhanced/d7dc3bb716c4/original-6877-1600102051-24.jpg?crop=3480:1827;0,0%26downsize=1250:*",2020-09-14T17:07:17.911596Z,
94,"{'id': 'hacker-news', 'name': 'Hacker News'}",,Careers,Careers at EasyPost,https://www.easypost.com/careers,https://assets.easypost.com/assets/images/branding/easypost-primary-icon-padded.5054062c4cf8df85bf1b511d4c93fb9b.png,2020-09-14T17:07:15.5371878Z,We give our employees the autonomy to work the way they want to get the job done.We believe in using the right tools to solve the right problems at the right times.We empower employees by working ope… [+59 chars]
95,"{'id': 'the-hindu', 'name': 'The Hindu'}",Puja Mehra,The pandemic has necessitated us to reconsider the 42% devolution assigned in the 2020-21 report: N.K. Singh,"Unlike in the past, we may not have the luxury of assuming constant rates of growth throughout the period 2021-22 to 2025-26, says Chairman of the FFC N.K. Singh",https://www.thehindu.com/business/Economy/the-pandemic-has-necessitated-us-to-reconsider-the-42-devolution-assigned-in-the-2020-21-report/article32603885.ece,https://www.thehindu.com/business/Economy/y1am32/article31644366.ece/ALTERNATES/LANDSCAPE_615/TH21NKSINGH,2020-09-14T17:06:02Z,The Fifteenth Finance Commission (FFC) will submit its report containing recommendations on the sharing of tax revenues between the Centre and States for the period 2021-22 to 2025-26 to the Presiden… [+10286 chars]
96,"{'id': 'news24', 'name': 'News24'}",,EFF members in court for Stellenbosch Clicks protest,The 16 people arrested in Stellenbosch during a protest over Clicks' online TRESemme hair product advertisement have appeared in the town's magistrate's court.,https://www.news24.com/news24/southafrica/news/eff-members-in-court-for-stellenbosch-clicks-protest-20200914,https://cdn.24.co.za/files/Cms/General/d/10493/b3c015c1f13143b0a422d9d6719cc330.jpg,2020-09-14T17:05:57+00:00,<ul><li> Sixteen people arrested during a protest at Clicks in Stellenbosch appeared in court on Monday.</li><li>They were angry that their case stalled on Friday and to avoid the weekend in jail app… [+2609 chars]
97,"{'id': 'ign', 'name': 'IGN'}",Jesse Schedeen,Ant-Man 3: Lovecraft Country's Jonathan Majors Reportedly Cast as Kang the Conqueror - IGN,"Deadline reports Lovecraft Country star Jonathan Majors has been cast as a major villain in Ant-Man 3, and he could be playing Kang the Conqueror.",https://www.ign.com/articles/ant-man-3-mcu-villain-kang-the-conqueror-jonathan-majors,https://assets1.ignimgs.com/2020/09/14/nb3q5txm-1557509880761-1600102947143.jpg?width=1280,2020-09-14T17:05:12Z,"Lovecraft Country star Jonathan Majors is reportedly heading to the Marvel Cinematic Universe, and he may be playing one of the most iconic Marvel villains of all time. Deadline reports Majors has si… [+2158 chars]"
98,"{'id': 'cnn', 'name': 'CNN'}","Arlette Saenz, CNN","Biden campaign readies massive legal team for voting, election issues",Joe Biden's campaign has assembled an extensive legal team to focus on voting and election issues.,http://us.cnn.com/2020/09/14/politics/biden-election-voting/index.html,https://cdn.cnn.com/cnnnext/dam/assets/200909141515-02-biden-mi-0909-super-tease.jpg,2020-09-14T17:04:28Z,
99,"{'id': 'news24', 'name': 'News24'}",,Man admits to strangling intern doctor girlfriend to death at hospital where she worked,"The man who has pleaded guilty to murdering his girlfriend who was an intern doctor at Mankweng hospital, says he did so after receiving text message that annoyed him.",https://www.news24.com/news24/SouthAfrica/News/man-admits-to-strangling-intern-doctor-girlfriend-to-death-at-hospital-where-she-worked-20200914,https://cdn.24.co.za/files/Cms/General/d/10493/2e5202c367084de384689179ad4db57d.jpeg,2020-09-14T17:02:56+00:00,"<ul><li>A 26-year-old man has pleaded guilty to murdering his girlfriend, who was a medical intern, at the Mankweng hospital in Polokwane, Limpopo.</li><li>The accused went to the hospital and strang… [+2743 chars]"
