,source,author,title,description,url,urlToImage,publishedAt,content
37,"{'id': 'business-insider-uk', 'name': 'Business Insider (UK)'}","Weng Cheong, Maddy Simpson","What engineers, data scientists, business analysts make at LinkedIn - Business Insider","Engineers can make up to $317,500, and business analysts can make as much as $156,000, according to Business Insider's salary analysis.",http://uk.businessinsider.com/how-much-engineers-data-scientists-business-analysts-make-at-linkedin-2020-9,https://i.insider.com/5f5b9ed97ed0ee001e25ecf0?width=1200&format=jpeg,2020-09-14T18:02:14Z,"Landing a job at LinkedIn can mean earning a six-figure salary. 
LinkedIn is the largest online professional network, and the company has more than 10,000 employees worldwide. Much like other tech c… [+4398 chars]"
38,"{'id': 'cbs-news', 'name': 'CBS News'}",Kathryn Watson,Watch live: Trump makes West Coast swing as deadly wildfires ravage homes and forests,"President Trump is making a rare West Coast swing, making both an official stop and a campaign stop.",https://www.cbsnews.com/news/watch-live-trump-wildfires-west-coast-live-stream-today-09-14-2020/,https://cbsnews3.cbsistatic.com/hub/i/r/2020/09/12/a8a75433-96bc-4581-af6d-c21a1c34bdcb/thumbnail/1200x630g4/b7ce999cd627feb6035744d096b79d48/gettyimages-1228400613.jpg,2020-09-14T18:01:28+00:00,"President Trump is making a rare West Coast swing Monday, as wildfires ravage California, Oregon and Washington. Mr. Trump is participating in a briefing on the wildfires in McClellan Park, Californi… [+1651 chars]"
39,"{'id': 'the-verge', 'name': 'The Verge'}",Jon Porter,Xbox Series X and S: everything you need to know about the next-gen of Xbox,"Microsoft has officially announced its two next-generation consoles: the Xbox Series X and the Xbox Series S. They’re part of a big next-generation strategy for Microsoft, which also includes subscription services and game streaming.",https://www.theverge.com/21432635/xbox-series-x-s-release-date-news-price-features-specs-hardware-games,https://cdn.vox-cdn.com/thumbor/FqwiPgspTjsmAYUJ8U2YskI4kOU=/0x86:2040x1154/fit-in/1200x630/cdn.vox-cdn.com/uploads/chorus_asset/file/21865121/twarren_200908_4177_0008.0.jpg,2020-09-14T18:00:00Z,"The next-generation of Xbox gaming is a little more complicated than what were used to. This past week, Microsoft announced its releasing not one but two new consoles: the Xbox Series X and the Xbox … [+28366 chars]"
40,"{'id': 'ars-technica', 'name': 'Ars Technica'}",Timothy B. Lee,Nikola admits prototype was rolling downhill in promotional video,"“This thing fully functions,” Trevor Milton said in 2016. It didn't.",https://arstechnica.com/cars/2020/09/nikola-admits-prototype-was-rolling-downhill-in-promotional-video/,https://cdn.arstechnica.net/wp-content/uploads/2020/09/Screen-Shot-2020-09-14-at-1.34.30-PM-760x380.png,2020-09-14T17:58:59+00:00,"Enlarge/ A Nikola video shows the Nikola One prototype rolling down a shallow hill in Utah. Nikola now says it never claimed the truck was driving under its own power.
60 with 46 posters participati… [+5247 chars]"
41,"{'id': 'techcrunch', 'name': 'TechCrunch'}",Jonathan Shieber,Clinic Price Check has built a service to see if patients can save money by paying cash for procedures,"Before launching Clinic Price Check, Joanne Rodrigues-Craig had been a stay-at-home mom with Masters degrees in population demographics, political science and applied mathematics from Berkeley and the London School of Economics. She’d written a book on demogr…",https://techcrunch.com/2020/09/14/clinic-price-check-has-built-a-service-to-see-if-patients-can-save-money-by-paying-cash-for-procedures/,https://techcrunch.com/wp-content/uploads/2019/06/GettyImages-1050719352.jpg?w=589,2020-09-14T17:57:46Z,"Before launching Clinic Price Check, Joanne Rodrigues-Craig had been a stay-at-home mom with Masters degrees in population demographics, political science and applied mathematics from Berkeley and th… [+4468 chars]"
42,"{'id': 'financial-times', 'name': 'Financial Times'}",,Traders switch to FX after central banks numb bond markets,"Interventions made fixed income less attractive for short-term bets, analysts say",https://www.ft.com/content/f9a90f8f-2ef5-45dc-973f-ed1c5c4dcc08,https://www.ft.com/__origami/service/image/v2/images/raw/https%3A%2F%2Fd1e00ek4ebabms.cloudfront.net%2Fproduction%2F8e61c438-b8e4-4593-95ba-d27554167fe0.jpg?source=next-opengraph&fit=scale-down&width=900,2020-09-14T17:52:26.7478243Z,"Foreign exchange is becoming the new playground for bond investors looking to profit from sharp moves in prices, after central banks’ aggressive response to Covid-19 robbed them of opportunities in f… [+4884 chars]"
43,"{'id': 'financial-times', 'name': 'Financial Times'}",,Investors in Japan should get set for a ‘Suga high’,Longer-term analysts will be taking a good look at problems such as low productivity,https://www.ft.com/content/df8e075a-1bfe-4df9-85b0-0c07f28c0bdb,https://www.ft.com/__origami/service/image/v2/images/raw/https%3A%2F%2Fd1e00ek4ebabms.cloudfront.net%2Fproduction%2F205be37d-7ab1-4861-8e08-4dcf91718b2d.jpg?source=next-opengraph&fit=scale-down&width=900,2020-09-14T17:52:24.4827632Z,"Yoshihide Suga, Japan’s chief cabinet secretary, has been picked as the new leader of the Liberal Democratic Party (LDP). If all goes as assumed, he will become prime minister on 16 September.
Inves… [+4359 chars]"
44,"{'id': 'buzzfeed', 'name': 'Buzzfeed'}","[{""@type"":""Person"",""name"":""Ryan Schocket"",""url"":""https://www.buzzfeed.com/ryanschocket2"",""jobTitle"":""BuzzFeed Staff""}]",15 Hilarious Gay Tweets From This Week,The sidewalk graphic is extremely accurate.,https://www.buzzfeed.com/ryanschocket2/gay-tweets-from-this-week-sept14,"https://img.buzzfeed.com/buzzfeed-static/static/2020-09/14/17/enhanced/7f93f941377c/original-6887-1600103813-36.jpg?crop=1244:651;0,89%26downsize=1250:*",2020-09-14T17:52:22.7956818Z,The sidewalk graphic is extremely accurate.
45,"{'id': 'financial-times', 'name': 'Financial Times'}",,"Santander and UBS chairs should testify in €112m Orcel suit, court rules",Ana Botín and Axel Weber called to give evidence over lender’s decision to cancel hiring of UBS banker,https://www.ft.com/content/cb0f4ac1-eced-4371-a298-42c0cc1424af,https://www.ft.com/__origami/service/image/v2/images/raw/https%3A%2F%2Fd1e00ek4ebabms.cloudfront.net%2Fproduction%2Fea904253-15e7-450b-b63d-9bd766c8450f.jpg?source=next-opengraph&fit=scale-down&width=900,2020-09-14T17:52:22.3739126Z,"Santander chair Ana Botín and UBS chairman Axel Weber will be called to testify over the Spanish lender’s U-turn in hiring Andrea Orcel as chief executive, a Madrid court decided on Monday.
Mr Orcel… [+2608 chars]"
46,"{'id': 'financial-times', 'name': 'Financial Times'}",,Nikola admits rolling truck down hill as it counters ‘fraud’ claims,"Start-up issues 2,700-word rebuttal to ‘false and misleading’ short seller report",https://www.ft.com/content/a875fe3f-f59e-4dcb-aebc-ee54280122be,https://www.ft.com/__origami/service/image/v2/images/raw/https%3A%2F%2Fd1e00ek4ebabms.cloudfront.net%2Fproduction%2F6e58f8ab-a7d0-460b-9a64-1794754081b1.jpg?source=next-opengraph&fit=scale-down&width=900,2020-09-14T17:52:18.2030754Z,"Nikola relied on supplier technology in early models and used a truck rolling downhill in a marketing video, the company has admitted, as it set out a lengthy defence of the truck start-up’s business… [+3790 chars]"
47,"{'id': 'fox-news', 'name': 'Fox News'}",Fox News,CNN’s Jake Tapper pestered GOP candidate Sean Parnell for statement dismissing scandalous DM: source,"CNN’s Jake Tapper has been pestering Republican congressional candidate Sean Parnell to issue a joint statement, as the “State of the Union” anchor tries to clean up the mess he created by attempting to talk him out of running for a Western Pennsylvania House…",https://www.foxnews.com/media/cnn-jake-tapper-sean-parnell-dm-scandal,https://static.foxnews.com/foxnews.com/content/uploads/2020/09/Tapper-Parnell-CNN.jpg,2020-09-14T17:52:16.8127953Z,"EXCLUSIVE: CNN’s Jake Tapper has been pestering Republican congressional candidate Sean Parnell to issue a joint statement with him, as the “State of the Union” anchor tries to clean up the mess he c… [+6547 chars]"
48,"{'id': 'financial-times', 'name': 'Financial Times'}",,Trump administration to review Oracle’s TikTok deal this week,Panel will recommend whether to approve ‘technical partnership’ with China’s ByteDance,https://www.ft.com/content/0ccd4a25-381f-46a7-a9e6-ee12ecf1aa88,https://www.ft.com/__origami/service/image/v2/images/raw/https%3A%2F%2Fd1e00ek4ebabms.cloudfront.net%2Fproduction%2F8883d653-710a-49be-85e9-da91e3a8a0bf.jpg?source=next-opengraph&fit=scale-down&width=900,2020-09-14T17:52:16.344163Z,The Trump administration will review the “technical partnership” deal that ByteDance struck with Oracle for TikTok’s US operations before making a recommendation to Donald Trump about whether it shou… [+3795 chars]
49,"{'id': 'business-insider', 'name': 'Business Insider'}",Irene Jiang,Millennials are killing the ethnic aisle — and that's a good thing - Business Insider,"The definition of ""mainstream"" in American cuisine is in perpetual motion, and so is the definition of what is outside of it, experts say.",http://www.businessinsider.com/millennials-killing-the-ethnic-aisle-and-thats-a-good-thing-2020-9,https://i.insider.com/5f5bbc39e6ff30001d4e860d?width=1200&format=jpeg,2020-09-14T17:52:16Z,"Salsa, soy sauce, and masala have nothing in common. So why are these seemingly random ingredients often lumped together into one section of the grocery store: the ethnic aisle?
""In 2020, this doesn… [+3161 chars]"
50,"{'id': 'business-insider-uk', 'name': 'Business Insider (UK)'}",Irene Jiang,Millennials are killing the ethnic aisle — and that's a good thing - Business Insider,"The definition of ""mainstream"" in American cuisine is in perpetual motion, and so is the definition of what is outside of it, experts say.",http://uk.businessinsider.com/millennials-killing-the-ethnic-aisle-and-thats-a-good-thing-2020-9,https://i.insider.com/5f5bbc39e6ff30001d4e860d?width=1200&format=jpeg,2020-09-14T17:52:16Z,"Salsa, soy sauce, and masala have nothing in common. So why are these seemingly random ingredients often lumped together into one section of the grocery store: the ethnic aisle?
""In 2020, this doesn… [+3161 chars]"
51,"{'id': 'techcrunch', 'name': 'TechCrunch'}",Travis Bernard,Extra Crunch Partner Perk: Discount on Dell XPS Laptop and Dell for Entrepreneurs Program,"We’re excited to announce a new Partner Perk from Dell for Extra Crunch members. Starting today, annual and 2-year Extra Crunch members can get a discount on a Dell XPS Laptop as well as a discount on membership to the Dell for Entrepreneurs Program. What is …",https://techcrunch.com/2020/09/14/extra-crunch-partner-perk-discount-on-dell-xps-laptop-and-dell-for-entrepreneurs-program/,https://techcrunch.com/wp-content/uploads/2020/09/EC-dell-alt1.jpg?w=753,2020-09-14T17:52:10Z,"Were excited to announce a new Partner Perk from Dell for Extra Crunch members. Starting today, annual and 2-year Extra Crunch members can get a discount on a Dell XPS Laptop as well as a discount on… [+1992 chars]"
52,"{'id': 'ars-technica', 'name': 'Ars Technica'}",Kate Cox,"YouTube unlawfully violates kids’ privacy, new $3.2B lawsuit claims","YouTube is “a weird technicolored nightmare” for families, nonprofit alleges.",https://arstechnica.com/tech-policy/2020/09/google-faces-3-2b-lawsuit-over-claims-it-violated-childrens-privacy/,https://cdn.arstechnica.net/wp-content/uploads/2020/09/GettyImages-1149449078-760x380.jpg,2020-09-14T17:51:48+00:00,"Enlarge/ A sign featuring the YouTube logo, outside the YouTube Space studios in London on June 4, 2019. 
17 with 14 posters participating
A new lawsuit filed in a United Kingdom court alleges that… [+4266 chars]"
53,"{'id': 'techcrunch', 'name': 'TechCrunch'}",Alex Wilhelm,"As low-code startups continue to attract VC interest, what's driving customer demand?","Investor interest in no-code, low-code apps and services advanced another step this morning with Airtable raising an outsized round. The $185 million investment into the popular database-and-spreadsheet service comes as it adds “new low-code and automation fe…",https://techcrunch.com/2020/09/14/as-low-code-startups-continue-to-attract-vc-interest-whats-driving-customer-demand/,https://techcrunch.com/wp-content/uploads/2020/05/NSussman_Techcrunch_Exchange_v3-GRN.jpg?w=533,2020-09-14T17:50:39Z,"Investor interest in no-code, low-code apps and services advanced another step this morning with Airtable raising an outsized round. The $185 million investment into the popular database-and-spreadsh… [+2307 chars]"
54,"{'id': 'cnn', 'name': 'CNN'}","Kate Sullivan, CNN",Joe Biden says US is facing 'one of the most difficult moments in our history',"Democratic presidential nominee Joe Biden said Monday that the United States is facing one of the most difficult moments in the nation's history, with ""four historic crises all at the same time.""",http://us.cnn.com/2020/09/14/politics/joe-biden-wildfires-climate-crisis/index.html,https://cdn.cnn.com/cnnnext/dam/assets/200902153805-204-biden-lead-image-super-tease.jpg,2020-09-14T17:48:05Z,"(CNN)Democratic presidential nominee Joe Biden said Monday that the United States is facing one of the most difficult moments in the nation's history, with ""four historic crises all at the same time.… [+752 chars]"
55,"{'id': 'the-hill', 'name': 'The Hill'}",Jordain Carney,GOP chairman to release interim report on Biden probe 'in about a week' | TheHill,Senate Homeland Security Chairman Ron Johnson (R-Wis.) said on Monday that he will soon release an interim report from his months-long probe involving the Obama administration and Hunter Biden.,http://thehill.com/homenews/senate/516325-gop-chairman-to-release-interim-report-on-biden-probe-in-about-a-week,https://thehill.com/sites/default/files/johnsonron_072120gn_lead.jpg,2020-09-14T17:47:10Z,Senate Homeland Security Chairman Ron JohnsonRonald (Ron) Harold JohnsonJohnson asks DOJ watchdog to investigate Mueller team phones over erased informationIntel panel rebuffs request to share info f… [+3906 chars]
56,"{'id': 'techcrunch', 'name': 'TechCrunch'}",Jonathan Shieber,Facebook launches a climate change information center and commits to eliminating 'scope 3' emissions by 2030,"Even as Facebook, the world’s largest social media platform, admits that climate change “is real” and that “the science is unambiguous and the need to act grows more urgent by the day” the platform appears unwilling to take steps to really stand up to the cli…",https://techcrunch.com/2020/09/14/facebook-launches-a-climate-change-information-center-and-commits-to-eliminating-scope-3-emissions-by-2030/,https://techcrunch.com/wp-content/uploads/2019/11/GettyImages-659827634.jpg?w=600,2020-09-14T17:46:52Z,"Even as Facebook, the world’s largest social media platform, admits that climate change “is real” and that “the science is unambiguous and the need to act grows more urgent by the day” the platform a… [+3392 chars]"
57,"{'id': 'espn', 'name': 'ESPN'}",Jake TrotterESPN Staff Writer ,"Cleveland Browns boot kicker Austin Seibert for Cody Parkey, source says",The Browns have promoted kicker Cody Parkey from their practice squad and waived Austin Seibert after he missed two kicks in Cleveland's Week 1 loss.,http://espn.go.com/nfl/story/_/id/29885830/browns-boot-kicker-austin-seibert-cody-parkey-source-says,https://a4.espncdn.com/combiner/i?img=%2Fphoto%2F2020%2F0506%2Fr695967_1296x729_16%2D9.jpg,2020-09-14T17:46:00Z,"The Cleveland Browns are making a kicking change.
The Browns waived starter Austin Seibert on Monday after he missed an extra point and field goal in Sunday's 38-6 loss at Baltimore, according to a … [+914 chars]"
58,"{'id': 'cbs-news', 'name': 'CBS News'}",CBS News,Saturday Sessions: Phoebe Bridgers performs “I Know The End”,"Phoebe Bridgers was just 22 when she made “Stranger in the Alps,” her acclaimed 2017 debut. Since then, she has been involved in collaborations with Conor Oberst and others. She also became a producer of albums herself, including her latest, titled “Punisher.…",https://www.cbsnews.com/video/saturday-sessions-phoebe-bridgers-performs-i-know-the-end/,https://cbsnews2.cbsistatic.com/hub/i/r/2020/09/14/fe7c9d24-463f-405e-a190-2096a1042d0d/thumbnail/1200x630/59077ec327ba6ccac294ccf1b70cce7d/satmosessions-iknowtheend-546428-640x360.jpg,2020-09-14T17:45:14+00:00,"Watch CBSN Live
Copyright © 2020 CBS Interactive Inc. All rights reserved."
59,"{'id': 'the-huffington-post', 'name': 'The Huffington Post'}",Ryan Grenoble,"Trump Flails In Attempt To Defend High-Risk, Indoor Campaign Rally In Nevada","“I’m on a stage and it’s very far away,” Trump told the Las Vegas Review-Journal. “And so I’m not at all concerned.""",https://www.huffpost.com/entry/trump-indoor-nevada-rally-not-concerned_n_5f5f814dc5b68d1b09c5a36b,https://img.huffingtonpost.com/asset/5f5f9eef1e0000fc0e475943.jpeg?cache=vak6eazjgu&ops=1778_1000,2020-09-14T17:42:19Z,"Donald Trump attempted to defend his decision to hold an indoor campaign rally in Henderson, Nevada, on Sunday by blaming Nevada Gov. Steve Sisolak (D) and ignoring the possibility that hes risking A… [+2476 chars]"
60,"{'id': 'ign', 'name': 'IGN'}",Chris Reed,LEGO Nintendo Entertainment System NES Is Up at Amazon - IGN,"This 2,646-piece set is now available for preorder.",https://www.ign.com/articles/lego-nintendo-entertainment-system-nes-is-now-available,https://assets1.ignimgs.com/2020/08/01/lego-nes-1596289316347.jpg?width=1280,2020-09-14T17:40:41Z,"The LEGO Nintendo Entertainment System has sold out at the LEGO Store, where it's currently a timed exclusive item, but it's finally available for preorder at Amazon for $229.99. It's not cheap, but … [+1064 chars]"
61,"{'id': 'rte', 'name': 'RTE'}",Ingrid Miley,"Number of people claiming PUP falls below 210,000","The number of people claiming the Pandemic Unemployment Payment has fallen to just under 210,000 - down 64% on the peak in May, when almost 600,000 were dependent on the payment for income support.",https://www.rte.ie/news/coronavirus/2020/0914/1165176-pandemic-unemployment-payment/,https://img.rasset.ie/001524ce-1600.jpg,2020-09-14T17:40:01Z,"The number of people claiming the Pandemic Unemployment Payment has fallen to just under 210,000 - down 64% on the peak in May, when almost 600,000 were dependent on the payment for income support.
… [+2909 chars]"
62,"{'id': 'breitbart-news', 'name': 'Breitbart News'}",Allum Bokhari,YouTube Censors Video of Trump Coronavirus Adviser for Contradicting W.H.O.,"Big Tech platforms continue to censor conservatives for offering commentary on the Chinese coronavirus. The latest victim is the Hoover Institution, the Stanford University-based conservative think tank, which posted a video to YouTube of an interview with Ho…",http://www.breitbart.com/tech/2020/09/14/youtube-censors-video-of-trump-coronavirus-adviser-for-contradicting-w-h-o/,https://media.breitbart.com/media/2017/05/youtube-Susan-Wojcicki-AP.jpg,2020-09-14T17:39:06Z,"Big Tech platforms continue to censor conservatives for offering commentary on the Chinese coronavirus. The latest victim is the Hoover Institution, the Stanford University-based conservative think t… [+2431 chars]"
63,"{'id': 'breitbart-news', 'name': 'Breitbart News'}",AWR Hawkins,"50 Shot, 15 Fatally, During Last Week in Mayor Young's Baltimore","Fifty people were shot, 15 fatally, during the last week in Mayor Bernard Young's (D) Baltimore, Maryland.",http://www.breitbart.com/politics/2020/09/14/50-shot-15-fatally-during-last-week-in-mayor-youngs-baltimore/,https://media.breitbart.com/media/2019/07/AP_19183754043023-640x335.jpg,2020-09-14T17:38:02Z,"Fifty people were shot, 15 fatally, during the last week in Mayor Bernard Young’s (D) Baltimore, Maryland.
CBS Baltimore reports that shootings occurred Sunday, September 6, 2020, through Sunday, Se… [+1654 chars]"
64,"{'id': 'financial-times', 'name': 'Financial Times'}",,Thomas Piketty on going from data-crunching to documentary,The economist talks about transforming his economic opus ‘Capital in the Twenty-First Century’ into a 100-minute film,https://www.ft.com/content/4969eb37-7d36-4d63-959f-4ea5548c4ad8,https://www.ft.com/__origami/service/image/v2/images/raw/https%3A%2F%2Fd1e00ek4ebabms.cloudfront.net%2Fproduction%2Fa9adc3ee-8f87-4e60-aa6a-3eb0774ec8ce.jpg?source=next-opengraph&fit=scale-down&width=900,2020-09-14T17:37:26.2964835Z,"Thomas Piketty is associated with mind-numbing data analysis. Yet in normal times the best-selling French economist is also a cinema lover, often going twice a week. “It’s one of the good things of b… [+7412 chars]"
65,"{'id': 'buzzfeed', 'name': 'Buzzfeed'}","[{""@type"":""Person"",""name"":""Ryan Schocket"",""url"":""https://www.buzzfeed.com/ryanschocket2"",""jobTitle"":""BuzzFeed Staff""}]",16 Hilarious Fails From This Week,The meal story...,https://www.buzzfeed.com/ryanschocket2/fails-from-this-week-sept14,"https://img.buzzfeed.com/buzzfeed-static/static/2020-09/14/15/enhanced/348ba8bac7a5/original-6776-1600098205-25.jpg?crop=2985:1562;0,214%26downsize=1250:*",2020-09-14T17:37:20.5635347Z,"And be sure to follow these tweeters for a better, funnier TL!"
66,"{'id': 'financial-times', 'name': 'Financial Times'}",,What happens if Trump loses but refuses to concede?,"News, analysis and comment from the Financial Times, the worldʼs leading global business publication",https://www.ft.com/content/c8767e22-a727-4a23-90bf-8d2844ca257a,,2020-09-14T17:37:20.5635347Z,"Donald Trump has repeatedly refused to commit to accepting the election outcome © Mandel Ngan/AFP/Getty 
As Americans prepare to cast their vote in the US election, a nightmare scenario looms large:… [+344 chars]"
67,"{'id': 'ign', 'name': 'IGN'}",Jesse Schedeen,Kang the Conqueror: How Endgame Subtly Set Up the New MCU Villain for Ant-Man 3 - IGN,We explore the possibility that the aftermath of Avengers: Endgame fueled the MCU debut of the major Avengers villain Kang the Conqueror.,https://www.ign.com/articles/avengers-endgame-kang-the-conqueror-villain-time-travel,https://assets1.ignimgs.com/2020/09/14/kang-the-conqueror-mcu-ant-man-1600104549253.jpg?width=1280,2020-09-14T17:36:25Z,"Avengers: Endgame may not be the first MCU movie to deal with the concept of time travel, but it certainly makes full use of that popular sci-fi movie trope. And as Marty McFly will tell you, the pro… [+5323 chars]"
68,"{'id': 'nhl-news', 'name': 'NHL News'}",NHL Public Relations,NHL statement on COVID-19 testing results,The National Hockey League today released the following statement on COVID-19 testing results:,https://www.nhl.com/news/nhl-statement-on-covid-19-testing-results/c-319020760,https://cms.nhl.bamgrid.com/images/photos/298127792/1024x576/cut.png,2020-09-14T17:34:50Z,
69,"{'id': 'cbs-news', 'name': 'CBS News'}",Nicole Brown,"Trump's explanation for why he downplayed coronavirus is ""disingenuous,"" Jeh Johnson says","The former Homeland Security secretary said Mr. Trump's campaign strategy ""is to create panic and instill fear in the American people.""",https://www.cbsnews.com/news/trump-downplayed-coronavirus-disingenuous-jeh-johnson/,https://cbsnews2.cbsistatic.com/hub/i/r/2020/09/14/24ebdf1b-487c-4c94-9a2d-33b8023aea8c/thumbnail/1200x630/c0323ef6a0f3005822365a75928befa8/1600100363684.png,2020-09-14T17:34:01+00:00,"President Donald Trump's defense for admittedly downplaying the risks of the coronavirus is ""disingenuous,"" former Secretary of Homeland Security Jeh Johnson said Monday. Mr. Trump told journalist Bo… [+2902 chars]"
70,"{'id': 'bloomberg', 'name': 'Bloomberg'}",Christopher Palmeri,"Caesars, DraftKings Jump After Companies Sign ESPN Betting Deals",Shares of Caesars Entertainment Inc. and DraftKings Inc. jumped after the companies announced they would become “co-exclusive” sports-betting partners with Walt Disney Co.’s ESPN network.,https://www.bloomberg.com/news/articles/2020-09-14/caesars-draftkings-jump-after-companies-sign-espn-betting-deals,https://assets.bwbx.io/images/users/iqjWHBFdfxIU/ip7m145NnKvE/v0/1200x800.jpg,2020-09-14T17:33:00+00:00,"Shares of 
Caesars Entertainment Inc. and 
DraftKings Inc. jumped after the companies announced they would become “co-exclusive” sports-betting partners with 
Walt Disney Co.’s ESPN network.
Caes… [+1899 chars]"
71,"{'id': 'cbs-news', 'name': 'CBS News'}",CBS News,"The impact the ""Rising American Electorate"" could have on election","A group of voters known as the ""Rising American Electorate"" could have an important impact in the 2020 election. CBSN political reporter Caitlin Huey-Burns joins CBSN with the latest in the series, ""America's Right to Vote.""",https://www.cbsnews.com/video/the-impact-the-rising-american-electorate-could-have-on-election/,https://cbsnews3.cbsistatic.com/hub/i/r/2020/09/14/d80d5484-0c61-44ba-acb6-2ee01d63adcb/thumbnail/1200x630/6c32ffc96b3def21deccaf8be39a3061/0914-cbsn-ctn-americaelect-546416-640x360.jpg,2020-09-14T17:32:25+00:00,"Watch CBSN Live
Copyright © 2020 CBS Interactive Inc. All rights reserved."
